id,name,category,description,graphic_file,build_cost,construction_days,max_revenue,maintenance_cost,decay_rate,can_delete,is_default,required_land_value,required_population,jobs_provided,jobs_required,energy_provided,energy_required,education_provided,education_subtype,education_required,food_provided,food_required,housing_provided,housing_required,healthcare_provided,healthcare_subtype,healthcare_required,safety_impact,safety_attenuation,culture_impact,culture_attenuation,affordability_impact,affordability_attenuation,resilience_impact,resilience_attenuation,environment_impact,environment_attenuation,noise_impact,noise_attenuation,notes
cottage,Cottage,housing,"Small family home with 2 bedrooms",cottage.png,250,1,10,1,0.05,true,true,10,0,0,0,0,5,0,,0,0,0,2,0,0,,0,5,2,5,2,5,2,5,2,1,2,0,2,"Basic housing unit - 2 bedrooms house ~4 people"
farmers_market,Farmers Market,commercial,"Local food market providing jobs and fresh produce",farmers_market.png,250,2,25,3,0.15,true,true,20,0,10,10,0,0,0,,0,40,0,0,0,0,,0,5,2,5,2,20,2,10,2,2,2,0,2,"Creates jobs but needs workers to operate effectively"
apartment_complex,Apartment Complex,housing,"Multi-family housing with 8 bedrooms",apartments.png,1400,7,80,10,0.125,true,true,50,10,0,0,0,15,0,,0,0,0,8,0,0,,0,3,2,0,2,10,2,5,2,-2,2,5,2,"High-density housing for growing cities"
elementary_school,Elementary School,education,"Primary education for children ages 5-11",school_elementary.png,800,5,0,8,0.08,true,true,30,50,5,5,0,10,100,elementary,0,0,0,0,0,0,,0,10,3,15,3,0,2,10,3,5,2,-5,2,"Provides elementary education - requires teachers (jobs) to function"
hospital,Hospital,civic,"Medical facility providing healthcare services",hospital.png,2000,10,0,25,0.06,true,true,100,200,50,50,0,20,0,,0,0,0,0,0,200,general,0,15,4,5,2,-10,2,20,3,0,2,-10,3,"Major healthcare provider - needs many workers"
solar_farm,Solar Farm,energy,"Clean energy generation facility",solar_farm.png,1200,4,15,5,0.04,true,true,0,0,5,5,100,0,0,,0,0,0,0,0,0,,0,5,2,0,2,5,2,15,3,10,2,-5,2,"Renewable energy source with minimal staffing needs"
factory,Factory,industrial,"Manufacturing facility creating jobs",factory.png,3000,8,50,15,0.12,true,true,25,100,200,200,0,50,0,,0,0,0,0,0,0,,0,-10,3,-5,2,-15,2,5,2,-25,4,-25,4,"High-capacity job creator but major pollution source"
park,Park,civic,"Green space for recreation and community",park.png,150,2,0,2,0.02,true,true,0,0,2,2,0,0,0,,0,0,0,0,0,0,,0,10,3,15,3,10,2,5,2,20,3,0,2,"Community amenity improving quality of life"
library,Library,education,"Public library providing educational resources",library.png,600,4,0,6,0.05,true,true,40,75,15,15,0,8,50,general,0,0,0,0,0,0,,0,8,2,20,3,5,2,8,2,3,2,-3,2,"General education facility serving all ages"